Title,Company,Location,Salary,Tag,Posted
Process Developer Underwriting French Language,Genpact,Noida,,,Posted a day ago
Process Developer HRO,Genpact,Hyderabad,,,Posted 2 days ago
Process Developer Order to Cash,Genpact,,,,Posted 2 days ago
Process developer Invoice to cash collections,Genpact,Hyderabad,,,Posted 2 days ago
Lead Consultant PySpark Developer,Genpact,,,,Posted 2 days ago
Process Developer Order to Cash PTC,Genpact,,,,Posted 2 days ago
Lead Consultant SFDC Developer Experience Cloud,Genpact,Noida,,,Posted 2 days ago
Principal Consultant PowerBI Developer,Genpact,,,,Posted 2 days ago
Principal Consultant Full Stack Front End Developer,Genpact,Noida,,,Posted 2 days ago
Principal Consultant SFDC Developer Experience Cloud,Genpact,Noida,,,Posted 2 days ago
Process Developer Recruitment,Genpact,Hyderabad,,,Posted a day ago
Principal Consultant Full Stack Front End Developer,Genpact,Noida,,,Posted a day ago
Process Developer,Genpact,,,,Posted 2 days ago
Lead Consultant C Backend Developer,Genpact,,,,Posted 2 days ago
Technical Associate Full Stack Developer,Genpact,,,,Posted 2 days ago
Lead Consultant SFDC Developer Revenue Cloud,Genpact,Noida,,,Posted 2 days ago
Process Developer French Language,Genpact,,,,Posted 2 days ago
Lead Consultant UI Developer,Genpact,,,,Posted a day ago
Principal Consultant Power BI Developer,Genpact,Hyderabad,,,Posted 2 days ago
Eagle Developer Technical BA,Clifyx Technology,,,Quick Apply,Posted 4 hours ago
SAP Commerce Cloud Hybris Developer,IT Resonance Inc,Chennai,,Quick Apply,Posted 4 hours ago
AEM Assets Developer,Now100 Solutions Private Limited,,,Quick Apply,Posted 3 hours ago
ServiceNow Developer,Clifyx Technology,,,Quick Apply,Posted 3 hours ago
Sailpoint Developer,Clifyx Technology,,,Quick Apply,Posted 3 hours ago
SAP Datasphere Consultant Developer,IT Resonance Inc,Chennai,,Quick Apply,Posted 3 hours ago
SAP HYBRIS Developer,Geetha Technology Solutions,Pune,,Quick Apply,Posted 3 hours ago
Oracle APEX Developer,Now100 Solutions Private Limited,Delhi,,Quick Apply,Posted 2 hours ago
Senior Developer,Geetha Technology Solutions,Pune,,Quick Apply,Posted an hour ago
Liferay Developer,Now100 Solutions Private Limited,Remote,,Quick Apply,Posted 3 hours ago
C Developer,Geetha Technology Solutions,Pune,,Quick Apply,Posted an hour ago
PostgreSQL Developer,Geetha Technology Solutions,Chennai,,Quick Apply,Posted an hour ago
GPON OMCI Software Developer,Geetha Technology Solutions,,,Quick Apply,Posted an hour ago
Java Full Stack Developer,Shashwath Solution,,,Quick Apply,Posted 54 minutes ago
Embedded C C Developer,Geetha Technology Solutions,Pune,,Quick Apply,Posted an hour ago
UI Web Developer,Bounteous x Accolite,Chennai,,Quick Apply,Posted 3 hours ago
Salesforce nCino Developer,NTT Data,"Noida, India",,,Posted a day ago
Mainframe Developer,NTT Data,"Bengaluru, India",,,Posted 2 days ago
Microsoft Dynamics 365 CRM CE Senior Developer,NTT Data,"Bengaluru, India",,,Posted 2 days ago
Java Developer,Highradius,"Hyderabad, India",,,Posted 2 days ago
Backend Java Developer Jobs In Abroad Countries,Srv Global Consultancy Private Limited,,INR 35 - 60 LPA,Quick Apply,Posted 4 hours ago
Application Developer SAP UX,IBM,,,Quick Apply,Posted 6 days ago
Application Developer Azure Cloud FullStack,IBM,,,Quick Apply,Posted 5 days ago
Application Developer Salesforce,IBM,,,Quick Apply,Posted 6 days ago
Firmware Developer,IBM,Hyderabad,,Quick Apply,Posted 4 days ago
Application Developer Microsoft NET Stack,IBM,,,Quick Apply,Posted 5 days ago
SSIS Developer,Tata Consultancy Services Limited,Chennai,,,Posted 6 days ago
Application Developer Cloud FullStack,IBM,Hyderabad,,Quick Apply,Posted 6 days ago
Application Developer Asset Management,IBM,,,Quick Apply,Posted 5 days ago
Application Developer RPA,IBM,,,Quick Apply,Posted 6 days ago
ServiceNow Developer,ITC Infotech India Limited,ITC Infotech India Limited,,Quick Apply,Posted 5 days ago
Application Developer Salesforce,IBM,,,Quick Apply,Posted 5 days ago
Application Developer Cloud FullStack,IBM,,,Quick Apply,Posted 6 days ago
Firmware Developer,IBM,Hyderabad,,Quick Apply,Posted 5 days ago
ELK Developer,Virtusa,,,Quick Apply,Posted 5 days ago
RPA UiPath Developer,Capgemini Technology Services India Limited,Capgemini Technology Services India Limited,,Quick Apply,Posted 6 days ago
Rpa Automation Anywhere Developer,Capgemini Technology Services India Limited,Capgemini Technology Services India Limited,,Quick Apply,Posted 6 days ago
Application Developer EAI,IBM,,,Quick Apply,Posted 5 days ago
Application Developer Angular,IBM,,,Quick Apply,Posted 6 days ago
Application Developer Java Web Technologies,IBM,Hyderabad,INR 0.5 - 5 LPA,Quick Apply,Posted 6 days ago
Application Developer Java Web Technologies,IBM,Hyderabad,,Quick Apply,Posted 5 days ago
Application Developer Experience Front End,IBM,,,Quick Apply,Posted 6 days ago
Application Developer Microsoft Middleware,IBM,Pune,,Quick Apply,Posted 5 days ago
Application Developer AWS Cloud FullStack,IBM,,,Quick Apply,Posted 6 days ago
Application Developer AWS Cloud FullStack,IBM,,,Quick Apply,Posted 5 days ago
Application Developer AWS Cloud FullStack,IBM,Hyderabad,,Quick Apply,Posted 5 days ago
Software Developer Corporate Mobile Service Plan,IBM,,,Quick Apply,Posted 5 days ago
Application Developer Java Web Technologies,IBM,,INR 0.5 - 5 LPA,Quick Apply,Posted 6 days ago
Associate Front end developer,Bain Company India Pvt. Ltd.,Bain Company India Pvt. Ltd.,,Quick Apply,Posted 2 days ago
Angular Developer Onsite Hyderabad,Vmanico Technologies Inc,Angular Developer Onsite Hyderabad,,Quick Apply,Posted a day ago
REACT JS FRONTEND DEVELOPER INTERNSHIP,Maxgen Technologies Private Limited,,INR 2 - 4 LPA,Quick Apply,Posted a day ago
Developer Applications,Microland,,,Quick Apply,Posted 10 days ago
Business Processes Associate Consultant Fullstack Developer SAP Concur,SAP,,INR 3 - 20 LPA,Quick Apply,Posted 12 days ago
Business Processes Associate Consultant Fullstack Developer SAP Concur,SAP,,,Quick Apply,Posted 11 days ago
Developer Associate,SAP,,,Quick Apply,Posted 12 days ago
Developer Associate Java,SAP,,INR 3 - 20 LPA,Quick Apply,Posted 11 days ago
Power BI Qliksense Developer,Alstom,,,Quick Apply,Posted 9 days ago
Assistant Manager Java Spring Boot Developer,Genpact,,,,Posted 5 days ago
Consultant Dot Net FS Developer,Genpact,,,,Posted 5 days ago
Principal Consultant Power BI Developer,Genpact,Hyderabad,,,Posted 4 days ago
Consultant Databricks Developer with experience in Unity Catalog Python Spark Kafka for ETL,Genpact,Hyderabad,,,Posted 6 days ago
Principal Consultant Senior Python Developer,Genpact,,,,Posted 6 days ago
Net Angular Developer,Infosys Limited,"Pune, India",,,Posted 5 days ago
Oracle Integration Cloud OIC Developer,Infosys Limited,"Indore, India",,,Posted 5 days ago
XSLT Developer,Infosys Limited,"Bengaluru, India",,,Posted 5 days ago
Oracle Integration Cloud OIC Developer,Infosys Limited,"Noida, India",,,Posted 5 days ago
Oracle Integration Cloud OIC Developer,Infosys Limited,"Nagpur, India",,,Posted 5 days ago
Mainframe Senior Developer,Infosys Limited,"Bhubaneswar, India",,,Posted 5 days ago
Python Developer,Infosys Limited,"Bengaluru, India",,,Posted 5 days ago
Senior Java Developer,Infosys Limited,"Bengaluru, India",,,Posted 5 days ago
Process Developer Accounts Payable PTP,Genpact,,,,Posted 5 days ago
Principal Consultant Camunda Developer,Genpact,Noida,,,Posted 4 days ago
Process Developer,Genpact,,,,Posted 4 days ago
Principal Consultant SharePoint Developer,Genpact,,,,Posted 4 days ago
Lead Consultant Camunda Developer,Genpact,,,,Posted 4 days ago
Lead Consultant RPA Developer,Genpact,Noida,,,Posted 5 days ago
Consultant SFDC Developer Experience Cloud,Genpact,Noida,,,Posted 5 days ago
Process Developer AP,Genpact,,,,Posted 6 days ago
Lead Consultant Senior Java Developer,Genpact,Hyderabad,,,Posted 5 days ago
Assistant Manager UI React Js Developer,Genpact,,,,Posted 5 days ago
Consultant Java Developer,Genpact,Noida,,,Posted 5 days ago
AGM Sales Real Estate Developer Market Segment,Michael Page,"Hyderabad, India",,,Posted 2 days ago
Software Developer 3,NetSuite,"Bengaluru, India",,,Posted a day ago
Software Developer 2,NetSuite,"Bengaluru, India",,,Posted a day ago
NET Developer,NTT Data,"Gurugram, India",,,Posted 4 days ago
Process Developer Human Resource Shared Services,Genpact,,,,Posted 8 days ago
Process Developer,Genpact,,,,Posted 10 days ago
Process Developer Underwriting Support,Genpact,,,,Posted 10 days ago
Process Developer Invoice to Cash,Genpact,Noida,,,Posted 11 days ago
Process Developer,Genpact,Noida,,,Posted 8 days ago
Principal Consultant Dotnet FS Developer,Genpact,,,,Posted 8 days ago
Lead Consultant NodeJs Developer,Genpact,,,,Posted 11 days ago
Consultant UI developer,Genpact,,,,Posted 11 days ago
AM QPA developer,Genpact,Hyderabad,,,Posted 8 days ago
Principal Consultant C Backend Developer,Genpact,,,,Posted 13 days ago
Process Developer Record to Report,Genpact,,,,Posted 11 days ago
Lead Consultant SFDC Developer Experience Cloud,Genpact,Hyderabad,,,Posted 9 days ago
Process Developer,Genpact,Noida,,,Posted 9 days ago
Consultant Databricks Developer with experience in Unity Catalog Python Spark Kafka for ETL,Genpact,Hyderabad,,,Posted 9 days ago
Senior Principal Consultant Vision Plus developer SCS,Genpact,Pune,,,Posted 12 days ago
Lead Consultant Boomi Integration Developer,Genpact,Noida,,,Posted 12 days ago
Process Developer Accounts Payable,Genpact,,,,Posted 8 days ago
Lead Consultant Power BI Developer,Genpact,,,,Posted 9 days ago
Process Developer Accounts Payable,Genpact,,,,Posted 10 days ago
Lead Consultant Boomi Integration Developer,Genpact,Noida,,,Posted 11 days ago
Consultant Java Developer,Genpact,Hyderabad,,,Posted 12 days ago
Principle Consultant Python Developer,Genpact,Hyderabad,,,Posted 8 days ago
Principal Consultant Power BI Developer,Genpact,Hyderabad,,,Posted 10 days ago
Application Developer ServiceNow,IBM,"India, Cochin / Kochi / Ernakulam",,,Posted 12 days ago
Teamcenter Developer,ITC Infotech,"Bengaluru, India",,,Posted 13 days ago
Application Developer SAP ABAP HANA,IBM,"Bengaluru, India",,,Posted 12 days ago
Tableau developer,HCLTech,"Chennai, India",,,Posted 13 days ago
ServiceNow Developer,ITC Infotech,"Chennai, India",,,Posted 13 days ago
Application Developer RPA,IBM,"Gurugram, India",,,Posted 12 days ago
Application Developer Cloud FullStack,IBM,"Chennai, India",,,Posted 12 days ago
ServiceNow Developer,ITC Infotech,"Gurugram, Gurugram, India",,,Posted 13 days ago
Application Developer Cloud FullStack,IBM,"Pune, India",,,Posted 12 days ago
Senior Dotnet Developer,ITC Infotech,"Bengaluru, India",,,Posted 13 days ago
Software Developer L3 Engineer,IBM,"Bengaluru, India",,,Posted 12 days ago
Application Developer Microsoft Cloud,IBM,"India, Mysore",,,Posted 12 days ago
Low Code Developer,Microsoft,India,,,Posted 11 days ago
Java Backend Developer,ITC Infotech,"Bengaluru, India",,,Posted 13 days ago
Teamcenter Developer 5 to 12 Years,Capgemini Engineering,"Pune, India",,,Posted 13 days ago
Assistant Manager Java Developer,Vodafone,Pune,,,Posted 10 days ago
Python Developer,ITC Infotech,"Bengaluru, India",,,Posted 13 days ago
Architecture Design Development Application Developer I,Systechcorp Private Limited,,,Quick Apply,Posted 4 days ago
Associate Content Developer English,NxtWave Disruptive Technologies,Hyderabad,INR 5 - 7 LPA,Quick Apply,Posted 5 days ago
Oracle APEX Developer,Now100 Solutions Private Limited,,,Quick Apply,Posted 3 days ago
NodeJS Developer,Collegedunia,,,Quick Apply,Posted 3 days ago
Embedded Firmware Developer,Turtlemint,Pune,,Quick Apply,Posted 5 days ago
Embedded Firmware Developer,Turtlemint,Pune,,Quick Apply,Posted 4 days ago
Full Stack Developer Associate,Primetrace Technologies,,,Quick Apply,Posted 4 days ago
React Developer,asker Virtual Assistance Service,,,Quick Apply,Posted 4 days ago
Enterprise Information Systems Developer,Turtlemint,Delhi,,Quick Apply,Posted 5 days ago
ServiceNow Developer Self Service Automation,Amgen Technology Private Limited,Hyderabad,,Quick Apply,Posted 4 days ago
Dot Net Developer,Paulwin George (Proprietor of Angel And Genie),,,Quick Apply,Posted 6 days ago
Dot Net MVC Developer,Turtlemint,Pune,,Quick Apply,Posted 4 days ago
Dot Net Developer WPF and WCF,Turtlemint,Pune,,Quick Apply,Posted 4 days ago
Dot Net Developer requirements,Paulwin George (Proprietor of Angel And Genie),,,Quick Apply,Posted 6 days ago
Internship Full Stack Developer,Tata CLiQ,,,Quick Apply,Posted 4 days ago
Full Stack Developer SDE 1,NxtWave Disruptive Technologies,Hyderabad,,Quick Apply,Posted 4 days ago
Enterprise Information Systems Developer,Turtlemint,Pune,,Quick Apply,Posted 5 days ago
Full Stack Developer SDE 1,NxtWave Disruptive Technologies,Hyderabad,,Quick Apply,Posted 5 days ago
Dot Net Developer Winform Application C Programming,Turtlemint,Pune,,Quick Apply,Posted 5 days ago
Software Developer,Teamlease Digital Private Limited,,INR 0.5 - 4 LPA,Quick Apply,Posted 5 days ago
React Developer,Bottle Lab Technologies,,,Quick Apply,Posted 3 days ago
FullStack Developer,Collegedunia,,,Quick Apply,Posted 3 days ago
UI Developer,Turtlemint,Pune,,Quick Apply,Posted 5 days ago
Flutter Android Developer,Turtlemint,Pune,,Quick Apply,Posted 4 days ago
Salesforce Developer,Synopsys (India) Private Limited,Synopsys (India) Private Limited,,Quick Apply,Posted 4 days ago
React Native Developer,Collegedunia,,,Quick Apply,Posted 3 days ago
UI Developer,Amgen Technology Private Limited,Hyderabad,,Quick Apply,Posted 4 days ago
Mobile Application Developer,Now100 Solutions Private Limited,Hyderabad,,Quick Apply,Posted 3 days ago
Flutter Android Developer,Turtlemint,Pune,,Quick Apply,Posted 5 days ago
PL SQL Developer,Systechcorp Private Limited,"Chennai, Pune",,Quick Apply,Posted 5 days ago
Content Developer,Now100 Solutions Private Limited,"Delhi, Mumbai",,Quick Apply,Posted 3 days ago
PL SQL Developer,Systechcorp Private Limited,,,Quick Apply,Posted 5 days ago
Full Stack Developer JAVA Angular,Turtlemint,,,Quick Apply,Posted 4 days ago
Servicenow Developer,Systechcorp Private Limited,Hyderabad,,Quick Apply,Posted 4 days ago
Full Stack Developer JAVA Angular,Turtlemint,,,Quick Apply,Posted 5 days ago
PL SQL Developer,Systechcorp Private Limited,"Delhi, Hyderabad",,Quick Apply,Posted 5 days ago
Front End Developer,Trigyn Technologies Limited,,,Quick Apply,Posted 4 days ago
Dot Net Developer Winform Application C Programming,Turtlemint,Pune,,Quick Apply,Posted 4 days ago
Enterprise Information Systems Developer,Turtlemint,,,Quick Apply,Posted 4 days ago
Enterprise Information Systems Developer,Turtlemint,,,Quick Apply,Posted 5 days ago
Dotnet Developer,Achnet,,,Quick Apply,Posted 4 days ago
Dot Net Developer,Achnet,,,Quick Apply,Posted 4 days ago
Java Developer,Now100 Solutions Private Limited,Hyderabad,,Quick Apply,Posted 3 days ago
Java Developer,Turtlemint,Pune,,Quick Apply,Posted 5 days ago
FULL STACK DEVELOPER,Harman Connected Services Corporation India Private Limited,Harman Connected Services Corporation India Private Limited,,Quick Apply,Posted 5 days ago
Maximo Technical Developer,Now100 Solutions Private Limited,"Bengaluru, Chennai",,Quick Apply,Posted 3 days ago
Maximo Technical Developer,Now100 Solutions Private Limited,"Hyderabad, Kolkata",,Quick Apply,Posted 3 days ago
ASP NET MVC Developer,Now100 Solutions Private Limited,,,Quick Apply,Posted 3 days ago
Full Stack Developer JAVA Angular,Turtlemint,Pune,,Quick Apply,Posted 4 days ago
Full Stack Developer JAVA Angular,Turtlemint,Pune,,Quick Apply,Posted 5 days ago
Software Developer Intern,Achnet,,INR 0.5 - 1 LPA,Quick Apply,Posted 4 days ago
Embedded software Developer,Turtlemint,Pune,,Quick Apply,Posted 4 days ago
Frontend Web Developer,Now100 Solutions Private Limited,Hyderabad,,Quick Apply,Posted 3 days ago
Dot Net MVC Developer,Turtlemint,Pune,,Quick Apply,Posted 5 days ago
Flutter Android Developer,Turtlemint,,,Quick Apply,Posted 4 days ago
Dot Net Developer,Right Human Skills And Resources Private Limited,,INR 1 - 1.5 LPA,Quick Apply,Posted 4 days ago
Java Developer,Right Human Skills And Resources Private Limited,,INR 1 - 1.5 LPA,Quick Apply,Posted 4 days ago
PHP Developer,Right Human Skills And Resources Private Limited,,INR 1 - 1.5 LPA,Quick Apply,Posted 4 days ago
MERN STACK DEVELOPER INTERNSHIP,Maxgen Technologies Private Limited,,INR 1.5 - 3 LPA,Quick Apply,Posted 3 days ago
MERN Stack Developer,Sparks to Ideas,,INR 1 - 2.5 LPA,Quick Apply,Posted 4 days ago
Python Developer,Impact Hr Km Solutions,,INR 2 - 3 LPA,Quick Apply,Posted 4 days ago
PYTHON DEVELOPER INTERNSHIP AT PUNE,Maxgen Technologies Private Limited,"Jalna, Ratnagiri, Pune",INR 2 - 4 LPA,Quick Apply,Posted 3 days ago
WordPress Developer Night Shift Freshers Can apply,Prologic Web Solutions Private Limited,Noida,INR 2 - 5 LPA,Quick Apply,Posted 3 days ago
PYTHON DEVELOPER INTERNSHIP AT PUNE,Maxgen Technologies Private Limited,"Pune, Yavatmal, Akola",INR 1.5 - 3 LPA,Quick Apply,Posted 5 days ago
Python Developer,Right Human Skills And Resources Private Limited,,INR 1 - 2 LPA,Quick Apply,Posted 3 days ago
Backend Developer,Robotics Technologies,"Hyderabad, Bengaluru, Chennai",INR 4 - 18 LPA,Quick Apply,Posted 4 days ago
Conversational Developer,DAZN,Hyderabad,,Quick Apply,Posted 11 days ago
Software Developer QA Information Technology,ster DM Healthcare,,,Quick Apply,Posted 12 days ago
Associate Platform Developer II Salesforce,Amgen Technology Private Limited,Hyderabad,,Quick Apply,Posted 9 days ago
Python Developer,AlgoLeap Technologies,Hyderabad,,Quick Apply,Posted 12 days ago
Frontend Developer Cloud Applications,SCHNEIDER ELECTRIC SINGAPORE PTE LTD,,,Quick Apply,Posted 9 days ago
Frontend Developer Cloud Applications,SCHNEIDER ELECTRIC SINGAPORE PTE LTD,,,Quick Apply,Posted 11 days ago
Net Developer with Azure Cloud and DevOps Experience,Surtel Technologies,,,Quick Apply,Posted 13 days ago
SQL Database Developer Trainee,Pragma Edge Software Services Private Limited,Hyderabad,,Quick Apply,Posted 11 days ago
Power BI Developer,AlgoLeap Technologies,Hyderabad,,Quick Apply,Posted 12 days ago
Quantitative Developer Investment Management Pune India,Amethyst Partners,Quantitative Developer Investment Management Pune India,,,Posted 4 days ago
Java Developer Jobs In Abroad Countries,Srv Global Consultancy Private Limited,,INR 35 - 60 LPA,Quick Apply,Posted 11 days ago
PYTHON DEVELOPER INTERNSHIP AT PUNE,Maxgen Technologies Private Limited,"Aurangabad, Dhule, Pune",INR 2 - 4 LPA,Quick Apply,Posted 13 days ago
REACT JS DEVELOPER INTERNSHIP,Maxgen Technologies Private Limited,,INR 2.5 - 4.5 LPA,Quick Apply,Posted 12 days ago
Python Developer,Right Human Skills And Resources Private Limited,,INR 2 - 2.5 LPA,Quick Apply,Posted 9 days ago
Python Developer Fresher,Right Human Skills And Resources Private Limited,,INR 1.5 - 2.5 LPA,Quick Apply,Posted 7 days ago
PYTHON DEVELOPER INTERNSHIP AHMEDABAD,Maxgen Technologies Private Limited,,,Quick Apply,Posted 11 days ago
PYTHON DEVELOPER INTERNSHIP PUNE,Maxgen Technologies Private Limited,"Jalgaon, Pune, Nashik",INR 2 - 3.5 LPA,Quick Apply,Posted 8 days ago
Web Developer Backend,Right Human Skills And Resources Private Limited,,INR 1 - 2 LPA,Quick Apply,Posted 10 days ago
Software Developer Jobs In Abroad Countries,Vijay Sabarwal (Proprietorship of Advance Immigration Solutions),,INR 34 - 60 LPA,Quick Apply,Posted 10 days ago
Dotnet Developer Fresher,Foundit,,,Quick Apply,Posted 11 days ago
AI ML Developer,Sparks to Ideas,,INR 1 - 2.5 LPA,Quick Apply,Posted 12 days ago
Software Developer,CamelQ Software Solutions Private Limited,Hyderabad,INR 0.5 - 3.5 LPA,Quick Apply,Posted 12 days ago
Developer,CamelQ Software Solutions Private Limited,"Anantapur, Hyderabad, Bhimavaram",INR 2 - 2.5 LPA,Quick Apply,Posted 12 days ago
Flutter Developer,Cloud Knightbridge It And Recruitment LLP,,INR 2.5 - 3.5 LPA,Quick Apply,Posted 12 days ago
FLUTTER DEVELOPER INTERNSHIP AHMEDABAD,Maxgen Technologies Private Limited,,INR 1 - 2 LPA,Quick Apply,Posted 8 days ago
Flutter Developer,Right Human Skills And Resources Private Limited,,INR 0.5 - 1 LPA,Quick Apply,Posted 11 days ago
Java Developer,Srv Global Consultancy Private Limited,,INR 45.5 - 75.5 LPA,Quick Apply,Posted 12 days ago
Python Developer,Infosys Limited,"Gurugram, India",,,Posted 20 days ago
Azure Data Lake ADLS Developer Engineer,Infosys Limited,"Bengaluru, India",,,Posted 20 days ago
Azure Service Fabric Developer Engineer,Infosys Limited,"Bengaluru, India",,,Posted 20 days ago
Consultant Service Now Developer,Genpact,Noida,,,Posted 19 days ago
Process developer Order to cash,Genpact,,,,Posted 19 days ago
Lead Consultant Microsoft Power Platform PowerApps Developer and Support,Genpact,Noida,,,Posted 15 days ago
Process Developer Underwriting,Genpact,,,,Posted 16 days ago
Lead Consultant Service Now Developer,Genpact,,,,Posted 19 days ago
Process Developer Recruitment,Genpact,Noida,,,Posted 16 days ago
Lead Consultant Cloud Devops Developer,Genpact,Hyderabad,,,Posted 19 days ago
Process Developer Broker Technical Support Specialist,Genpact,,,,Posted 19 days ago
Process Developer Order to Cash PTC,Genpact,,,,Posted 17 days ago
Sr Principal Consultant PowerBi Developer,Genpact,Noida,,,Posted 16 days ago
Process Developer Broker Technical Support Specialist,Genpact,Noida,,,Posted 20 days ago
Process Developer Broker Technical Support Specialist,Genpact,Noida,,,Posted 16 days ago
Lead Consultant Power BI Developer,Genpact,,,,Posted 15 days ago
Principal Consultant UI Developer,Genpact,Noida,,,Posted 15 days ago
Process Developer Invoice To Cash,Genpact,,,,Posted 16 days ago
Lead Consultant SFDC Developer Experience Cloud,Genpact,Noida,,,Posted 17 days ago
Process Developer Broker Technical Support Specialist,Genpact,,,,Posted 16 days ago
Principal Consultant Java FS Developer,Genpact,,,,Posted 19 days ago
process developer order to cash,Genpact,,,,Posted 19 days ago
Process Developer Recruitment,Genpact,,,,Posted 16 days ago
Process Developer Invoice to cash,Genpact,Noida,,,Posted 16 days ago
Principal Consultant Vision Plus developer SCS,Genpact,Chennai,,,Posted 17 days ago
Principal Consultant Java Backend Developer,Genpact,Chennai,,,Posted 19 days ago
Application Developer Oracle eBS,IBM,"Gurugram, India",,,Posted 17 days ago
Application Developer Cloud FullStack,IBM,"Pune, India",,,Posted 17 days ago
Application Developer Microsoft NET Stack,IBM,"Gurugram, India",,,Posted 17 days ago
Application Developer Google Cloud Migration,IBM,"Bengaluru, India",,,Posted 17 days ago
Storage Software Developer,IBM,"Pune, India",,,Posted 17 days ago
Application Developer Cloud FullStack,IBM,"Chennai, India",,,Posted 17 days ago
Application Developer Microsoft NET Stack,IBM,"Bengaluru, India",,,Posted 17 days ago
Application Developer Java Web Technologies,IBM,"Hyderabad, India",,,Posted 17 days ago
Deputy Manager Fullstack Developer Pune,Vodafone,Deputy Manager Fullstack Developer Pune,,,Posted 20 days ago
Application Developer Microsoft Cloud,IBM,"Bengaluru, India",,,Posted 17 days ago
Application Developer Oracle eBS,IBM,"Bengaluru, India",,,Posted 17 days ago
Software Developer,IBM,"India, Cochin / Kochi / Ernakulam",,,Posted 16 days ago
Java Springboot Camunda Developer,Vodafone,Pune,,,Posted 18 days ago
Deputy Manager Microfocus Operations Orchestration Developer Bangalore,Vodafone,Deputy Manager Microfocus Operations Orchestration Developer Bangalore,,,Posted 16 days ago
Open BMC Developer,IBM,"Bengaluru, India",,,Posted 17 days ago
Application Developer Microsoft Middleware,IBM,"Pune, India",,,Posted 17 days ago
Application Developer SAP ABAP HANA,IBM,"Bengaluru, India",,,Posted 17 days ago
Application Developer Microsoft Cloud,IBM,"Hyderabad, India",,,Posted 17 days ago
Application Developer AWS Cloud FullStack,IBM,"Bengaluru, India",,,Posted 17 days ago
Java Developer,Highradius,"Hyderabad, India",,,Posted 16 days ago
Back End Developer,IBM,"Bengaluru, India",,,Posted 17 days ago
Application Developer AWS Cloud FullStack,IBM,"Bengaluru, India",,,Posted 16 days ago
Developer Marketing Specialist,Embed Workflow,India,,,Posted 13 days ago
Senior Developer,Antal International Network,"Mumbai, India",,,Posted 10 days ago
Frappe ERPNext developer,GalaxyERP Software Private Limited,"Surat, India",,,Posted 12 days ago
PowerCurve Collections Developer,NAB,"Gurugram, Gurugram, India",,,Posted 13 days ago
High Frequency Algorithm Developer,Uprety Capital,"Mumbai, India",,,Posted 13 days ago
Senior Power Platform Developer,Innovior,"Jaipur, India",,,Posted 13 days ago
Chatbot Developer,Acme Services,"Bengaluru, India",,,Posted 13 days ago
Webflow Developer,TeachEdison,"Coimbatore, India",,,Posted 12 days ago
IAM CyberArk Developer A Con HYD Pune BLR,Sampoorna Consultants Private Limited,IAM CyberArk Developer A Con HYD Pune BLR,,,Posted 12 days ago
Appian developer,WNS-Vuram,"Chennai, India",INR 5.65 - 5.65 LPA,,Posted 13 days ago
Service Now Developer,Team Geek Solutions,"Bengaluru, India",,,Posted 13 days ago
Developer Advocate,Discoveries Quintessential,"Bengaluru, India",,,Posted 13 days ago
Developer Ariba SAP,Vodastra Technologies,India,,,Posted 13 days ago
Salesforce Developer B2B SaaS Application Solutions,Expedite Commerce,India,,,Posted 13 days ago
Laravel Developer,BIGSCAL TECHNOLOGIES Pvt. Ltd.,"Surat, India",,,Posted 13 days ago
Net Developer,RN Jobforce,India,,,Posted 12 days ago
Senior Qlik Sense BI Developer,Technocrats Domain Inc,"Hyderabad, India",,,Posted 13 days ago
Power Apps Developer,Acme Services,"India, Nashik",,,Posted 13 days ago
SOC R D Developer,Soffit Infrastructure Services (P) Ltd,"India, Cochin / Kochi / Ernakulam",,,Posted 13 days ago
Associate Campaign Developer,Zeta Global,"Hyderabad, India",,,Posted 13 days ago
Campaign Developer,Zeta Global,"Hyderabad, India",,,Posted 13 days ago
aws developer,RN Jobforce,India,,,Posted 13 days ago
